{
  "worker_id": "dev-worker-DE5535B6",
  "worker_type": "feature-implementer",
  "prompt_template": "agents/prompts/workers/implementation-worker.md",
  "parent_master": "development",
  "task_id": "task-024",
  "task_data": {
    "id": "task-024",
    "title": "System Test - Coordinator Master: Verify task routing system by checking coordination/task-queue.json and coordination/workforce-streams.json, create routing verification report at tests/system-test-coordinator.txt with 'Coordinator Master Test Completed' message",
    "type": "development",
    "priority": "medium",
    "status": "assigned",
    "assigned_to": "development",
    "created_at": "2025-11-05T11:34:36Z",
    "created_by": "create-task-cli",
    "context": {
      "repository": "ry-ops/commit-relay",
      "branch": "main",
      "description": "System Test - Coordinator Master: Verify task routing system by checking coordination/task-queue.json and coordination/workforce-streams.json, create routing verification report at tests/system-test-coordinator.txt with 'Coordinator Master Test Completed' message",
      "requirements": []
    },
    "assigned_by": "coordinator",
    "assigned_at": "2025-11-05T11:42:30Z",
    "updated_at": "2025-11-05T05:42:30-06:00"
  },
  "context": {
    "master_session": "3A24DCEC-39A6-495F-AC3E-262F0EEEDB03",
    "expertise_area": "feature_development",
    "skills_required": [
      "design",
      "implementation",
      "testing"
    ],
    "knowledge_base_refs": {
      "implementation_patterns": "/Users/ryandahlberg/commit-relay/scripts/../coordination/masters/development/knowledge-base/implementation-patterns.jsonl",
      "architecture_docs": "/Users/ryandahlberg/commit-relay/scripts/../coordination/masters/development/knowledge-base/codebase-architecture.json"
    }
  },
  "resources": {
    "token_allocation": 15000,
    "time_limit_minutes": 60
  },
  "status": "running",
  "created_at": "2025-11-05T11:51:49Z",
  "created_by": "development",
  "execution": {
    "started_at": "2025-11-05T11:52:10Z"
  }
}
