{
  "worker_id": "dev-worker-EBE57D3B",
  "worker_type": "implementation-worker",
  "prompt_template": "agents/prompts/workers/implementation-worker.md",
  "parent_master": "development",
  "task_id": "moe-test-ddqd-v5-1763307968-bb0f7015",
  "task_data": {
  "id": "moe-test-ddqd-v5-1763307968-bb0f7015",
  "title": "Implement new API endpoint for user management feature",
  "type": "feature",
  "description": "Implement new API endpoint for user management feature",
  "priority": "medium",
  "status": "assigned",
  "assigned_to": "development",
  "created_at": "2025-11-16T09:46:53-0600",
  "created_by": "ddqd-v5-test",
  "moe_test": true,
  "test_id": "ddqd-v5-1763307968",
  "context": {},
  "assigned_by": "coordinator",
  "assigned_at": "2025-11-16T09:47:02-0600",
  "routing_confidence": "N/A",
  "routing_strategy": "pattern-based",
  "updated_at": "2025-11-16T09:47:02-06:00"
},
  "context": {
    "master_session": "3A24DCEC-39A6-495F-AC3E-262F0EEEDB03",
    "expertise_area": "",
    "skills_required": [],
    "knowledge_base_refs": {
      "implementation_patterns": "/Users/ryandahlberg/Projects/commit-relay/scripts/../coordination/masters/development/knowledge-base/implementation-patterns.jsonl",
      "architecture_docs": "/Users/ryandahlberg/Projects/commit-relay/scripts/../coordination/masters/development/knowledge-base/codebase-architecture.json"
    }
  },
  "resources": {
    "token_allocation": 50000,
    "time_limit_minutes": 60
  },
  "status": "pending",
  "created_at": "2025-11-17T13:15:30-0600",
  "created_by": "development"
}
