{
  "worker_id": "dev-worker-4FD07A66",
  "worker_type": "feature-implementer",
  "prompt_template": "agents/prompts/workers/implementation-worker.md",
  "parent_master": "development",
  "task_id": "task-1762366072",
  "task_data": {
    "id": "task-1762366072",
    "title": "Test orchestration: Add heartbeat visualization to dashboard showing last ping time for active workers. Simple single-file update to dashboard-v2.js.",
    "type": "development",
    "priority": "high",
    "status": "assigned",
    "assigned_to": "development",
    "created_at": "2025-11-05T19:09:30Z",
    "created_by": "create-task-cli",
    "context": {
      "repository": "ry-ops/commit-relay",
      "branch": "main",
      "description": "Test orchestration: Add heartbeat visualization to dashboard showing last ping time for active workers. Simple single-file update to dashboard-v2.js.",
      "requirements": []
    },
    "assigned_by": "coordinator",
    "assigned_at": "2025-11-05T19:09:36Z",
    "updated_at": "2025-11-05T13:09:36-06:00"
  },
  "context": {
    "master_session": "3A24DCEC-39A6-495F-AC3E-262F0EEEDB03",
    "expertise_area": "feature_development",
    "skills_required": [
      "design",
      "implementation",
      "testing"
    ],
    "knowledge_base_refs": {
      "implementation_patterns": "/Users/ryandahlberg/commit-relay/scripts/../coordination/masters/development/knowledge-base/implementation-patterns.jsonl",
      "architecture_docs": "/Users/ryandahlberg/commit-relay/scripts/../coordination/masters/development/knowledge-base/codebase-architecture.json"
    }
  },
  "resources": {
    "token_allocation": 15000,
    "time_limit_minutes": 60
  },
  "status": "running",
  "created_at": "2025-11-06T14:47:21Z",
  "created_by": "development",
  "execution": {
    "started_at": "2025-11-06T14:47:26Z"
  }
}
