{
  "worker_id": "dev-worker-FE2F7024",
  "worker_type": "bug-fixer",
  "prompt_template": "agents/prompts/workers/implementation-worker.md",
  "parent_master": "development",
  "task_id": "moe-test-ddqd-v5-1762626013-d03c64a3",
  "task_data": {
  "id": "moe-test-ddqd-v5-1762626013-d03c64a3",
  "title": "Fix performance bug in database query optimization code",
  "type": "bug-fix",
  "description": "Fix performance bug in database query optimization code",
  "priority": "medium",
  "status": "assigned",
  "assigned_to": "development",
  "created_at": "2025-11-08T12:20:59-0600",
  "created_by": "ddqd-v5-test",
  "moe_test": true,
  "test_id": "ddqd-v5-1762626013",
  "context": {},
  "assigned_by": "coordinator",
  "assigned_at": "2025-11-08T12:26:22-0600",
  "routing_confidence": "0.95",
  "routing_strategy": "single_expert",
  "updated_at": "2025-11-08T12:26:22-06:00"
},
  "context": {
    "master_session": "3A24DCEC-39A6-495F-AC3E-262F0EEEDB03",
    "expertise_area": "bug_resolution",
    "skills_required": [
  "debugging",
  "root_cause_analysis",
  "testing"
],
    "knowledge_base_refs": {
      "implementation_patterns": "/Users/ryandahlberg/projects/commit-relay/scripts/../coordination/masters/development/knowledge-base/implementation-patterns.jsonl",
      "architecture_docs": "/Users/ryandahlberg/projects/commit-relay/scripts/../coordination/masters/development/knowledge-base/codebase-architecture.json"
    }
  },
  "resources": {
    "token_allocation": 10000,
    "time_limit_minutes": 60
  },
  "status": "pending",
  "created_at": "2025-11-08T14:18:57-0600",
  "created_by": "development"
}
